owner_id,team_id,team_name,owner,status,primary_color,secondary_color,decal_color,location,record,titles,playoff_appearances,tagline,franchise_story,primary_logo,secondary_logo,uniform_image,team_page
bard,the-commish,The Commish,Bard,Active,#79cedc,#0f2043,#d5a458,CT,122-69-1,2,12,Commissioner power questionable rulings and a permanent target on his back,Our commissioner, our fearless leader, the man who brings us fantasy football each and every week! He only has one thought constantly on his mind and that is sports. He is off to flight school but we hardly trust this kid running our Fantasy Football League. He will bet on anything from the Super Bowl to Cricket to how many suspensions Leonard Fournette will receive this upcoming season. The answer is always at least 1. You can catch him watching random college volleyball games or random Australian soccer matches late on a Tuesday. You think you like sports, this kid might have ya beat.,images/the-commish-primary.png,images/the-commish-secondary.png,images/the-commish-uniform.png,team.html?owner=bard
jake,cincinnati-harambes,Cincinnati Harambes,Jake,Active,#012351,#a20d2d,#a4acaf,CT,92-85-1,3,6,Built on Cincinnati pride chaos and the memory of a fallen legend,A former Miami Dolphins fan now turned New York Giants fan. He bleeds G MEN Blue so much that he uttered the phrase “Gettelman is a top 5 GM”. He too was once a part of a frat but unlike other members of the league *cough*cough* you wouldn't have guessed it. He is a gym teacher twice over with less athleticism than you think. But as the saying goes, "Those who can't do, teach. And those who can't teach, teach gym" The real question that is on everyones mind is.... How are his brothers and sisters?,images/cincinnati-harambes-primary.png,images/cincinnati-harambes-secondary.png,images/cincinnati-harambes-uniform.png,team.html?owner=jake
muffin,committed-not-addicted,Committed Not Addicted,Muffin,Active,#000000,#ffb612,#ffffff,KRDU,102-90-1,2,7,A franchise built on dedication denial and refreshing the app way too much,The man with a nickname that is too hard to explain the origin story for but why would we use his first name anyways. The only man I have ever known to love everything in Pittsburgh. From his lonely Pirates to his unbearable Steelers and even to when Hines Ward made it in Dark Night Rises. He left us for South Carolina, moved to North Carolina to marry a girl, got a job selling computers, two dogs and a new house. He is the closest yet the farthest thing from an adult that we have in this league. He probably will never come north of the Mason Dixon Line but that's okay because most of us hardly would go that south to see him anyways.,images/committed-not-addicted-primary.png,images/committed-not-addicted-secondary.png,images/committed-not-addicted-uniform.png,team.html?owner=muffin
miner,jakes-brothers-and-sisters,Jakes Brothers and Sisters,Miner,Active,#0C2340,#ffffff,#404040,NYC,84-108,0,4,A family operation with just enough dysfunction to fit right into the league,Accountant by day and nothing else by night. All he has in his life is his love for boats and the New York Yankees but not much else after that! Don't text him about live sporting events because he is that guy that likes to record them! Yeah, he is one of those weirdos! He likes cheese balls and quesadillas more than the average person. He likes to go fishing in his spare time and considers himself the best fisherman in our town but the man just doesnt catch fish. He will tell you he's okay with that but secretly deep down he hates it. He is just bad at everything he does, fantasy football included. ,images/jakes-brothers-and-sisters-primary.png,images/jakes-brothers-and-sisters-secondary.png,images/jakes-brothers-and-sisters-uniform.png,team.html?owner=miner
kyle,life-sucks-then-you-die,Life Sucks then You Die,Kyle,Active,#00b0b0,#c80f2e,#F6EB61,BOS,54-74,0,3,A franchise name that doubles as a roster-building philosophy,Our most handsome friend who likes futbol more than football. Biggest Liverpool fan you will ever meet and if anyone else in this league tells you differently they are lying to you! He has been playing fantasy football longer than following the sport itself. He came around to it since we needed the seventh member for the league. By day he is a teacher at school but by afternoon he is a lovely nanny as well. He is the number one small town freshman soccer coach in the state but at least that is what he tells us. He can grow a nice beard too but since quratnine began others might have him beat. ,images/life-sucks-then-you-die-primary.png,images/life-sucks-then-you-die-secondary.png,images/life-sucks-then-you-die-uniform.png,team.html?owner=kyle
hunter,most-valuable-potheads,Most Valuable Potheads,Hunter,Active,#0e8a44,#fcde02,#d51c2c,CT,86-107-1,0,3,High upside questionable process and somehow always involved in a group chat argument,Our MVP on and off the field. The greatest man to ever walk the earth. He left us for the beaches of South Carolina and we don't blame him one bit. He is the biggest Lebron James fan you will ever meet but don't call him a front runner! He also likes Andrew McCutchen and might be the only Indianapolis Colts fan in the world too! After not being able to handle the pandemic in Florida, he moved back North to become.... an Electrician? Alright you do you kid!!!,images/most-valuable-potheads-primary.png,images/most-valuable-potheads-secondary.png,images/most-valuable-potheads-uniform.png,team.html?owner=hunter
gary,the-fantasy-football-team,The Fantasy Football Team,Gary,Active,#737369,#53544c,#baac92,CT,61-84,1,3,Simple name serious expectations and a franchise that refuses to overcomplicate the brand,A man who came to us after serving a few tours overseas yet still each Sunday watches his dreadful New York Jets take the field. He's a real (super) trooper! He makes a mean brisket and pulled pork or at least his dad does. He has gotten into fishing and gambling lately both are going just fine if you ask him. If there is one thing though about this man, it is that he is consistent. Go look at those weird similar yearly Fantasy Football stats. The man shaved his head over a bet nobody made with him. Thats what we call commitment. ,images/the-fantasy-football-team-primary.png,images/the-fantasy-football-team-secondary.png,images/the-fantasy-football-team-uniform.png,team.html?owner=gary
sco,trin-coll-pest-control,Trin Coll Pest Control,Sco,Active,#004179,#f3c404,#e87928,NJ,76-53,2,5,The league’s official exterminator of hope momentum and occasionally his own roster,Yep. He has a cool middle name so we named the last place trophy after it. He doesn't bring much else to the table. He started liking sports and then the world started to end. He moved away to DC to get away from the rest of us. When you meet him he will introduce himself as being in a frat during his college days. Remember though that is just what they do. He is big into politics and falling asleep early at parties. But don't listen to him because in the end he's wrong and you will need to fact check him!!!,images/trin-coll-pest-control-primary.png,images/trin-coll-pest-control-secondary.png,images/trin-coll-pest-control-uniform.png,team.html?owner=sco
eric,team-eric,Team Eric,Eric,Inactive,#004C54,#A5ACAF,#111827,TBD,,,,Legacy notes coming soon,,,,,team-template.html
sabella,team-sabella,Team CJ,Sabella,Inactive,#4F2683,#FFC62F,#111827,TBD,,,,Legacy notes coming soon,,,,,team-template.html
charlie,team-charlie,Team Charlie,Charlie,Inactive,#FFA500,#000000,#111827,TBD,,,,Legacy notes coming soon,,,,,team-template.html
miller,team-miller,Team Miller,Miller,Inactive,#FF0000,#0000FF,#111827,TBD,,,,Legacy notes coming soon,,,,,team-template.html
